,0,1,2,3,4,5,6,7,8,9,10,11,12,13,14,15,16,17,18,19,20,21,22,23,24,25,26,27,28,29,30,31,32,33,34,35,36,37,38,39,40,41,42,43,44,45,46,47,48,49,50,51,52,53,54,55,56,57,58,59,60,61,62,63,64,65,66,67,68,69,70,71,72,73,74,75,76,77,78,79,80,81,82,83,84,85,86,87,88,89,90,91,92,93,94,95,96,97,98,99,100,101,102,103,104,105,106,107,108,109,110,111,112,113,114,115,116,117,118,119,120,121,122,123,124,125,126,127,128,129,130,131,132,133,134,135,136,137,138,139,140,141,142,143,144,145,146,147,148,149,150,151,152,153,154,155,156,157,158,159,160,161,162,163,164,165,166,167,168,169,170,171,172,173,174,175,176,177,178,179,180,181,182,183,184,185,186,187,188,189,190,191,192,193,194,195,196,197,198,199,200,201,202,203,204,205,206,207,208,209,210,211,212,213,214,215,216,217,218,219,220,221,222,223,224,225,226,227,228,229,230,231,232,233,234,235,236,237,238,239,240,241,242,243,244,245,246,247,248,249,250,251,252,253,254,255,256,257,258,259,260,261,262,263,264,265,266,267,268,269,270,271,272,273,274,275,276,277,278,279,280,281,282,283,284,285,286,287,288,289,290,291,292,293,294,295,296,297,298,299,300,301,302,303,304,305,306,307
0,hi thank you so much for watching i hope you enjoyed today is video,i loved the video and might i add you are beautiful,awe thank you so much,where do u get your milk frother from i need one,at home with jasmin i am also interested in getting the nespresso milkfrother would you mind linking it wa the milk frother included in your package thanks so much for your help and the video xxx,the milk frother i have is also from nespresso,just orderd mine i can not wait,at home with jasmin i do thanks,i hope you love it,you are so clean beautiful kitchen,thank you so much,if you are looking for an easy to use machine this is it,it is a great machine for sure,how is the temperature of the brew,i personally think it is a great temperature it is not cold or lukewarm where you feel like you have to heat it up or anything i also add warm frothed milk and it is still great,i can not stop staring at the snow how beautiful,it wa so nice while it lasted,the snow falling in the background,ahh i loved that too,beautiful coffee machine nice unboxing review it is very helpful thanks,thank you so glad it helped,where do you get the money for all those awesome stuff much love,thanks for watching we just pick and choose what item we like to splurge on and which one we do not,i have the same one patiently waiting for christmas to open it thanks for the review,can not wait for you to open it and try it out i hope you enjoy it,i have always wanted to try the nespresso,you will love it,hello friend beautiful your coffee maker i love coffee very beautiful and elegant this coffee maker loved i wish you a blessed merry christmas to you and your family,thank you so much for watching merry christmas to you and yours,awesome,thanks,that is an awesome coffee maker,i agree i love it so far,,,,,,,,,,,,,,,,,,,,,,,,,,,,,,,,,,,,,,,,,,,,,,,,,,,,,,,,,,,,,,,,,,,,,,,,,,,,,,,,,,,,,,,,,,,,,,,,,,,,,,,,,,,,,,,,,,,,,,,,,,,,,,,,,,,,,,,,,,,,,,,,,,,,,,,,,,,,,,,,,,,,,,,,,,,,,,,,,,,,,,,,,,,,,,,,,,,,,,,,,,,,,,,,,,,,,,,,,,,,,,,,,,,,,,,,,,,,,,,,,,,,,,,,,,,,,,,,,,,,,,,,,,,,,,,,,,,
1,i do not understand with this bluetooth that is build in what people can control the nespresso machine from their own bed to make coffee for them,greattttt very thorough review,,hi erin i like the outfit you have on what brand is it pls and thanks it look great on you,i have got a keurig 2 0 probably 7 8 year old and a nespresso vertuo past 2 year side by side on my counter i enjoy good quality cafe coffee and yes even starbucks mostly i want just coffee over say espresso or latte but i do enjoy those i use the keurig probably 4 to 1 over the nespresso latte at home with nespresso is good but definitely far from a properly created latte at a coffee shop regular coffee though i have found a couple k cup i like such a costco is kirkland pacific bold that cost around dollar 30 cup cdn or starbucks verona a well for about dollar 50 70 per cup but the bigger issue i have is the 7 77oz size of the full cup nespresso v getting a 10oz from keurig they have the alto size but just two flavour good but not great imo and at 14oz just too large they temperature is not a big deal unless you add milk cream but is quite a bit cooler than keurig starbucks ha just started selling vertuo pod at grocery store but it is a bit of a head scratcher that 8 pod is dollar10 v about 12 k cup for the same money i have tried side by side and despite the crema they taste very similar i am guessing the aluminum pod just cost more i just wish nespresso would start offering a 9 77oz size to fill my cup a bit more anyway great review,great feedback andrew thank you,your video are getting better and better,thanks pablo,nice video fun and informative thank you,judging by your last few review you really are a coffee lover always good to see independent review though,erin lawrence my pleasure enjoy your review and the info you provide,thanks,erin is gorgeous with this dress,thanks erin,nice review perhaps the app provides info back to nespresso on how customer are using their machine and which capsule they are purchasing they might be using it for marketing reason which are rather underhanded,true,i had to look up what a canadian double double wa far from y all here in south texas love the review thanks for sharing,thank you and now you have to try a double double,good sunday afternoon to you all from wellington somerset in the uk,thanks for stopping by the channel,whaoo,you are looking fantastic,,,,,,,,,,,,,,,,,,,,,,,,,,,,,,,,,,,,,,,,,,,,,,,,,,,,,,,,,,,,,,,,,,,,,,,,,,,,,,,,,,,,,,,,,,,,,,,,,,,,,,,,,,,,,,,,,,,,,,,,,,,,,,,,,,,,,,,,,,,,,,,,,,,,,,,,,,,,,,,,,,,,,,,,,,,,,,,,,,,,,,,,,,,,,,,,,,,,,,,,,,,,,,,,,,,,,,,,,,,,,,,,,,,,,,,,,,,,,,,,,,,,,,,,,,,,,,,,,,,,,,,,,,,,,,,,,,,,,,,,,,,,,,
